{
  "$schema": "https://json-schema.org/draft/2020-12/schema",
  "$id": "./city-catalog.v0.1.schema.json",
  "type": "object",
  "required": [
    "schemaVersion",
    "settlementId",
    "cityId",
    "status",
    "sourceAuthorities",
    "collections",
    "counts"
  ],
  "properties": {
    "schemaVersion": {
      "const": "0.1.0"
    },
    "settlementId": {
      "type": "string"
    },
    "cityId": {
      "type": "string"
    },
    "status": {
      "type": "string"
    },
    "sourceAuthorities": {
      "type": "object"
    },
    "collections": {
      "type": "object"
    },
    "counts": {
      "type": "object"
    }
  },
  "additionalProperties": false
}
